{"schema_version":1,"name":"mixed-defi","present_features":["uses-erc20","uses-erc4626","uses-amm","uses-lending","uses-oracle","uses-staking"],"absent_features":[],"must_select_domains":["evm-audit-general","evm-audit-erc20","evm-audit-erc4626","evm-audit-defi-amm","evm-audit-defi-lending","evm-audit-oracles","evm-audit-defi-staking"],"must_select_checks":["EVM-ERC20-001","EVM-ERC4626-001","EVM-AMM-001","EVM-LEND-001","EVM-ORACLE-001","EVM-STK-001"],"max_selected_checks":500,"max_runtime_bytes":343040,"max_total_context_bytes":976896,"expected_selected_domains":["evm-audit-defi-amm","evm-audit-defi-lending","evm-audit-defi-staking","evm-audit-erc20","evm-audit-erc4626","evm-audit-general","evm-audit-oracles"],"expected_deferred_domains":["evm-audit-access-control","evm-audit-assembly","evm-audit-bridges","evm-audit-chain-specific","evm-audit-dos","evm-audit-erc4337","evm-audit-erc721","evm-audit-flashloans","evm-audit-governance","evm-audit-precision-math","evm-audit-proxies","evm-audit-signatures"],"expected_filtered_domains":[]}
