{"schema_version":1,"name":"erc20","present_features":["uses-erc20"],"absent_features":[],"must_select_domains":["evm-audit-general","evm-audit-erc20"],"must_select_checks":["EVM-ERC20-001"],"must_not_filter_checks":["EVM-ERC20-001"],"max_selected_checks":170,"max_runtime_bytes":120832,"max_total_context_bytes":348160,"expected_selected_domains":["evm-audit-erc20","evm-audit-general"],"expected_deferred_domains":["evm-audit-access-control","evm-audit-assembly","evm-audit-bridges","evm-audit-chain-specific","evm-audit-defi-amm","evm-audit-defi-lending","evm-audit-defi-staking","evm-audit-dos","evm-audit-erc4337","evm-audit-erc4626","evm-audit-erc721","evm-audit-flashloans","evm-audit-governance","evm-audit-oracles","evm-audit-precision-math","evm-audit-proxies","evm-audit-signatures"],"expected_filtered_domains":[]}
