{"schema_version":1,"name":"chain-specific","present_features":["uses-chain-specific"],"absent_features":[],"must_select_domains":["evm-audit-chain-specific","evm-audit-general"],"must_select_checks":["EVM-CHAIN-001"],"expected_selected_domains":["evm-audit-chain-specific","evm-audit-general"],"expected_deferred_domains":["evm-audit-access-control","evm-audit-assembly","evm-audit-bridges","evm-audit-defi-amm","evm-audit-defi-lending","evm-audit-defi-staking","evm-audit-dos","evm-audit-erc20","evm-audit-erc4337","evm-audit-erc4626","evm-audit-erc721","evm-audit-flashloans","evm-audit-governance","evm-audit-oracles","evm-audit-precision-math","evm-audit-proxies","evm-audit-signatures"],"expected_filtered_domains":[]}
