{"schema_version":1,"name":"staking","present_features":["uses-staking"],"absent_features":[],"must_select_domains":["evm-audit-general","evm-audit-defi-staking"],"must_select_checks":["EVM-STK-001"],"max_selected_checks":190,"max_runtime_bytes":126976,"max_total_context_bytes":369664,"expected_selected_domains":["evm-audit-defi-staking","evm-audit-general"],"expected_deferred_domains":["evm-audit-access-control","evm-audit-assembly","evm-audit-bridges","evm-audit-chain-specific","evm-audit-defi-amm","evm-audit-defi-lending","evm-audit-dos","evm-audit-erc20","evm-audit-erc4337","evm-audit-erc4626","evm-audit-erc721","evm-audit-flashloans","evm-audit-governance","evm-audit-oracles","evm-audit-precision-math","evm-audit-proxies","evm-audit-signatures"],"expected_filtered_domains":[]}
