{
  "schema_version": 1,
  "name": "erc4626",
  "present_features": ["uses-erc4626"],
  "absent_features": [],
  "domain_scope": ["evm-audit-general", "evm-audit-erc4626"],
  "expected_selected_domains": ["evm-audit-general", "evm-audit-erc4626"],
  "expected_selected_checks": 162,
  "expected_filtered_checks": 0,
  "must_select_checks": ["EVM-GEN-001", "EVM-ERC4626-043", "ERC4626-ROUND-001"],
  "must_not_filter_checks": ["EVM-ERC4626-043", "ERC4626-ROUND-001"],
  "max_runtime_bytes": 116736,
  "max_total_context_bytes": 336896
}
