{"schema_version":1,"name":"incomplete-compilation","present_features":[],"absent_features":["uses-assembly"],"compilation_complete":false,"must_select_domains":["evm-audit-general"],"must_select_checks":["EVM-GEN-020"],"must_not_filter_checks":["EVM-ASM-019"],"expected_selected_domains":["evm-audit-general"],"expected_deferred_domains":["evm-audit-access-control","evm-audit-assembly","evm-audit-bridges","evm-audit-chain-specific","evm-audit-defi-amm","evm-audit-defi-lending","evm-audit-defi-staking","evm-audit-dos","evm-audit-erc20","evm-audit-erc4337","evm-audit-erc4626","evm-audit-erc721","evm-audit-flashloans","evm-audit-governance","evm-audit-oracles","evm-audit-precision-math","evm-audit-proxies","evm-audit-signatures"],"expected_filtered_domains":[]}
