{
  "schema_version": 1,
  "name": "minimal",
  "present_features": [],
  "absent_features": [],
  "domain_scope": [
    "evm-audit-general"
  ],
  "expected_selected_domains": [
    "evm-audit-general"
  ],
  "expected_selected_checks": 109,
  "expected_filtered_checks": 0,
  "must_select_checks": [
    "EVM-GEN-001"
  ],
  "must_not_filter_checks": [
    "EVM-GEN-020"
  ],
  "max_runtime_bytes": 92160,
  "max_total_context_bytes": 262144,
  "expected_deferred_domains": [],
  "expected_filtered_domains": []
}
